{
  "schema_version": "1.0",
  "summary": "Phase4 is release-ready for source handoff after passing automated checks, rebuilding web assets, and smoke-testing the packaged UI.",
  "release_version": "0.4.0-phase4-llm-ux",
  "build_artifacts": [
    "appforge/resources/web/index.html",
    "appforge/resources/web/assets/index-B8h20RM6.js",
    "appforge/resources/web/assets/index-CJQsWsDa.css"
  ],
  "install_and_run": [
    "Use the existing AppForge-LLM-v4 setup",
    "Run ./build.sh to prepare and open the local web UI",
    "Use ./build.sh --smoke for a no-browser health/static UI check"
  ],
  "configuration": [
    "Provider credentials remain configured through the LLM settings modal or existing auth CLI",
    "APPFORGE_LLM_BRIDGE_URL continues to point the web app at the local bridge",
    "No new Phase4 environment variable is required"
  ],
  "migrations": [
    "Clients using /providers/models should migrate to /providers?include_models=true or /providers/{id}/models",
    "No data migration is required for provider credentials or active model config"
  ],
  "release_checks": [
    {
      "check": "Bridge tests/typecheck",
      "passed": "passed",
      "evidence": "bun run typecheck and bun test passed"
    },
    {
      "check": "Frontend build",
      "passed": "passed",
      "evidence": "npm run build generated current hashed assets"
    },
    {
      "check": "Python quality",
      "passed": "passed",
      "evidence": "pytest passed 78 tests and ruff passed; targeted llm_auth regression passed 14 tests"
    },
    {
      "check": "Payload and smoke",
      "passed": "passed",
      "evidence": "Payload probe showed compact provider response; build.sh --smoke served health and UI"
    }
  ],
  "known_issues": [
    "No live credentialed LLM provider call was run",
    "No browser screenshot automation was captured"
  ],
  "rollback": [
    "Revert Phase4 source changes and rebuild frontend assets",
    "Restore /providers/models route only if downstream compatibility requires it"
  ]
}
